{
  "contract": {
    "contract_version": "1.0.0",
    "observation_id": "lbobs_00000103"
  },
  "provenance": {
    "provider_id": "PRV_BETA",
    "source_reference": "feed:PRV_BETA/pull/2027-04-02T10:00:00Z#item-201",
    "source_record_id": "201",
    "ingested_at": "2027-04-02T10:00:00Z"
  },
  "source_asserted": {
    "source_event_id": "B-EV-9100",
    "source_event_name": "Violet FC v Marigold United",
    "source_sport_label": "Football",
    "source_competition_id": "APD",
    "source_competition_label": "Aster Prem",
    "source_operator_id": "AUR",
    "source_operator_name": "AuroraSportsbook",
    "source_market_id": "1x2",
    "source_market_label": "1X2",
    "source_outcome_id": "H",
    "source_outcome_label": "Home Win",
    "source_participants": [
      { "source_participant_id": "vio", "source_participant_name": "Violet", "source_role": "home" },
      { "source_participant_id": "mar", "source_participant_name": "Marigold Utd", "source_role": "away" }
    ],
    "source_start_time": "2027-04-02T14:00:00+00:00",
    "source_observed_at": "2027-04-02T09:59:30+00:00",
    "source_jurisdiction": "GB",
    "price": 2.20,
    "price_format": "decimal"
  },
  "canonical": {
    "sport": "football",
    "competition_id": "lbcomp_0001",
    "competition": "Aster Premier Division",
    "event_id": null,
    "participants": [
      { "participant_id": "lbteam_0001", "participant_display_name": "Violet FC", "role": "home" },
      { "participant_id": "lbteam_0002", "participant_display_name": "Marigold United", "role": "away" }
    ],
    "operator_id": "lbop_0001",
    "operator_display_name": "Aurora Books",
    "market_id": "lbmkt_0001",
    "market": "1X2",
    "outcome_id": "lboutc_0001",
    "outcome": "home_win",
    "jurisdiction": "gb",
    "start_time": "2027-04-02T14:00:00Z"
  },
  "governance": {
    "admission_state": "QUARANTINED",
    "reason_codes": ["AMBIGUOUS_EVENT_IDENTITY"],
    "notes": "The same canonical participants and competition already have two governed events with materially different scheduled times (a rescheduled fixture and its original). No active governed source->event mapping disambiguates B-EV-9100, and no timing tolerance is ratified (LBIR-001). Fail closed: event_id remains null."
  }
}
