{
  "contract": {
    "contract_version": "1.0.0",
    "observation_id": "lbobs_00000105"
  },
  "provenance": {
    "provider_id": "PRV_ALPHA",
    "source_reference": "feed:PRV_ALPHA/snapshot/2027-03-14T15:07:00Z#row-5010",
    "source_record_id": "rec-5010",
    "ingested_at": "2027-03-14T15:07:00Z"
  },
  "source_asserted": {
    "source_event_id": "evt-55321",
    "source_event_name": "Violet FC v Marigold United",
    "source_sport_label": "Soccer",
    "source_competition_id": "comp-9",
    "source_competition_label": "Aster Premier Div",
    "source_operator_id": "op-77",
    "source_operator_name": "Aurora Books Feed",
    "source_market_id": "mkt-88",
    "source_market_label": "Anytime Scorer (novelty)",
    "source_outcome_id": "out-x9",
    "source_outcome_label": "Player Nine",
    "source_participants": [
      { "source_participant_id": "team-100", "source_participant_name": "Violet FC", "source_role": "home" },
      { "source_participant_id": "team-200", "source_participant_name": "Marigold United", "source_role": "away" }
    ],
    "source_start_time": "2027-03-14T15:00:00+00:00",
    "source_observed_at": "2027-03-14T15:06:58+00:00",
    "source_jurisdiction": "UK",
    "price": 4.50,
    "price_format": "decimal"
  },
  "canonical": {
    "sport": "football",
    "competition_id": "lbcomp_0001",
    "competition": "Aster Premier Division",
    "event_id": "lbev_000001",
    "participants": [
      { "participant_id": "lbteam_0001", "participant_display_name": "Violet FC", "role": "home" },
      { "participant_id": "lbteam_0002", "participant_display_name": "Marigold United", "role": "away" }
    ],
    "operator_id": "lbop_0001",
    "operator_display_name": "Aurora Books",
    "market_id": null,
    "market": null,
    "outcome_id": null,
    "outcome": null,
    "jurisdiction": "gb",
    "start_time": "2027-03-14T15:00:00Z"
  },
  "governance": {
    "admission_state": "QUARANTINED",
    "reason_codes": ["UNRESOLVED_MARKET_IDENTITY", "UNRESOLVED_OUTCOME_IDENTITY"],
    "notes": "No active governed mapping resolves this novelty market/outcome for PRV_ALPHA. The price and format are valid, but the market and outcome identities fail closed and remain null; the record is retained (not discarded)."
  }
}
